{
  "schema_version": "1.0.0",
  "methodology_version": "1.0.0",
  "tool_version": "0.1.0",
  "scanned_at": "2026-10-24T19:17:02Z",
  "week": "2026-43",
  "selection_rule": "Union of (a) npm stdio packages listed in the official MCP Registry (latest versions) and (b) npm search results for keywords mcp-server / mcp / modelcontextprotocol and the free text 'mcp server'. A candidate is kept if its latest version declares a `bin` and (is registry-listed OR depends on @modelcontextprotocol/sdk or @modelcontextprotocol/server OR has keyword `mcp-server`), its name does not match the library pattern (sdk|client|types|framework|inspector|proxy|gateway|bridge|cli-core), and it is not in exclusions.yaml. Ranked by npm weekly downloads; top N kept.",
  "top_n": 100,
  "packages": [
    {
      "name": "claude-cup",
      "version": "0.9.12",
      "weekly_downloads": 13559125,
      "registry_listed": false,
      "registry_name": null,
      "sources": [
        "npm_search"
      ]
    },
    {
      "name": "@playwright/mcp",
      "version": "0.0.83",
      "weekly_downloads": 3804915,
      "registry_listed": true,
      "registry_name": "io.github.microsoft/playwright-mcp",
      "sources": [
        "mcp_registry"
      ]
    },
    {
      "name": "firebase-tools",
      "version": "15.34.1",
      "weekly_downloads": 2281302,
      "registry_listed": true,
      "registry_name": "io.github.firebase/firebase-mcp",
      "sources": [
        "mcp_registry"
      ]
    },
    {
      "name": "chrome-devtools-mcp",
      "version": "1.12.0",
      "weekly_downloads": 2262793,
      "registry_listed": true,
      "registry_name": "io.github.ChromeDevTools/chrome-devtools-mcp",
      "sources": [
        "mcp_registry",
        "npm_search"
      ]
    },
    {
      "name": "color-space",
      "version": "3.5.0",
      "weekly_downloads": 559846,
      "registry_listed": true,
      "registry_name": "io.github.colorjs/color-space",
      "sources": [
        "mcp_registry"
      ]
    },
    {
      "name": "@upstash/context7-mcp",
      "version": "4.4.4",
      "weekly_downloads": 482795,
      "registry_listed": true,
      "registry_name": "io.github.upstash/context7",
      "sources": [
        "mcp_registry",
        "npm_search"
      ]
    },
    {
      "name": "@modelcontextprotocol/server-filesystem",
      "version": "2.0.0",
      "weekly_downloads": 439752,
      "registry_listed": false,
      "registry_name": null,
      "sources": [
        "npm_search"
      ]
    },
    {
      "name": "@modelcontextprotocol/server-pdf",
      "version": "2.0.3",
      "weekly_downloads": 424989,
      "registry_listed": false,
      "registry_name": null,
      "sources": [
        "npm_search"
      ]
    },
    {
      "name": "rea-agents",
      "version": "6.7.0",
      "weekly_downloads": 415576,
      "registry_listed": true,
      "registry_name": "io.github.morluto/rea",
      "sources": [
        "mcp_registry",
        "npm_search"
      ]
    },
    {
      "name": "@wonderwhy-er/desktop-commander",
      "version": "0.3.1",
      "weekly_downloads": 394686,
      "registry_listed": true,
      "registry_name": "io.github.wonderwhy-er/desktop-commander",
      "sources": [
        "mcp_registry",
        "npm_search"
      ]
    },
    {
      "name": "mcporter",
      "version": "0.16.0",
      "weekly_downloads": 269889,
      "registry_listed": false,
      "registry_name": null,
      "sources": [
        "npm_search"
      ]
    },
    {
      "name": "e2e",
      "version": "0.21.3",
      "weekly_downloads": 266186,
      "registry_listed": true,
      "registry_name": "io.github.tester-army/e2e",
      "sources": [
        "mcp_registry"
      ]
    },
    {
      "name": "@lovable.dev/mcp-js",
      "version": "3.3.0",
      "weekly_downloads": 231949,
      "registry_listed": false,
      "registry_name": null,
      "sources": [
        "npm_search"
      ]
    },
    {
      "name": "agent-device",
      "version": "0.21.31",
      "weekly_downloads": 217590,
      "registry_listed": true,
      "registry_name": "io.github.callstack/agent-device",
      "sources": [
        "mcp_registry",
        "npm_search"
      ]
    },
    {
      "name": "@modelcontextprotocol/server-everything",
      "version": "2.0.0",
      "weekly_downloads": 162420,
      "registry_listed": false,
      "registry_name": null,
      "sources": [
        "npm_search"
      ]
    },
    {
      "name": "yahoo-finance2",
      "version": "4.0.5",
      "weekly_downloads": 130353,
      "registry_listed": false,
      "registry_name": null,
      "sources": [
        "npm_search"
      ]
    },
    {
      "name": "@modelcontextprotocol/server-memory",
      "version": "2.0.0",
      "weekly_downloads": 122926,
      "registry_listed": false,
      "registry_name": null,
      "sources": [
        "npm_search"
      ]
    },
    {
      "name": "@pandacss/mcp",
      "version": "2.4.0",
      "weekly_downloads": 122624,
      "registry_listed": false,
      "registry_name": null,
      "sources": [
        "npm_search"
      ]
    },
    {
      "name": "@azure-devops/mcp",
      "version": "2.11.0",
      "weekly_downloads": 109717,
      "registry_listed": false,
      "registry_name": null,
      "sources": [
        "npm_search"
      ]
    },
    {
      "name": "@modelcontextprotocol/server-sequential-thinking",
      "version": "2.0.0",
      "weekly_downloads": 109582,
      "registry_listed": false,
      "registry_name": null,
      "sources": [
        "npm_search"
      ]
    },
    {
      "name": "@zereight/mcp-gitlab",
      "version": "2.3.8",
      "weekly_downloads": 103842,
      "registry_listed": true,
      "registry_name": "io.github.zereight/gitlab-mcp",
      "sources": [
        "mcp_registry",
        "npm_search"
      ]
    },
    {
      "name": "firecrawl-mcp",
      "version": "3.34.1",
      "weekly_downloads": 102401,
      "registry_listed": true,
      "registry_name": "io.github.firecrawl/firecrawl-mcp-server",
      "sources": [
        "mcp_registry",
        "npm_search"
      ]
    },
    {
      "name": "n8n-mcp",
      "version": "2.98.1",
      "weekly_downloads": 93806,
      "registry_listed": false,
      "registry_name": null,
      "sources": [
        "npm_search"
      ]
    },
    {
      "name": "@notionhq/notion-mcp-server",
      "version": "2.5.2",
      "weekly_downloads": 85371,
      "registry_listed": false,
      "registry_name": null,
      "sources": [
        "npm_search"
      ]
    },
    {
      "name": "hostinger-api-mcp",
      "version": "3.8.1",
      "weekly_downloads": 85188,
      "registry_listed": false,
      "registry_name": null,
      "sources": [
        "npm_search"
      ]
    },
    {
      "name": "@swmansion/argent",
      "version": "0.30.1",
      "weekly_downloads": 85112,
      "registry_listed": true,
      "registry_name": "io.github.software-mansion/argent",
      "sources": [
        "mcp_registry",
        "npm_search"
      ]
    },
    {
      "name": "mongodb-mcp-server",
      "version": "3.1.0",
      "weekly_downloads": 83264,
      "registry_listed": true,
      "registry_name": "io.github.mongodb-js/mongodb-mcp-server",
      "sources": [
        "mcp_registry"
      ]
    },
    {
      "name": "@sentry/mcp-server",
      "version": "0.42.0",
      "weekly_downloads": 77861,
      "registry_listed": true,
      "registry_name": "io.github.getsentry/sentry-mcp",
      "sources": [
        "mcp_registry",
        "npm_search"
      ]
    },
    {
      "name": "blume",
      "version": "2.2.5",
      "weekly_downloads": 75385,
      "registry_listed": false,
      "registry_name": null,
      "sources": [
        "npm_search"
      ]
    },
    {
      "name": "next-devtools-mcp",
      "version": "0.4.0",
      "weekly_downloads": 74748,
      "registry_listed": true,
      "registry_name": "io.github.vercel/next-devtools-mcp",
      "sources": [
        "mcp_registry",
        "npm_search"
      ]
    },
    {
      "name": "@tanstack/ai-mcp",
      "version": "1.0.0",
      "weekly_downloads": 73143,
      "registry_listed": false,
      "registry_name": null,
      "sources": [
        "npm_search"
      ]
    },
    {
      "name": "agentdb",
      "version": "3.0.0-alpha.20",
      "weekly_downloads": 71889,
      "registry_listed": false,
      "registry_name": null,
      "sources": [
        "npm_search"
      ]
    },
    {
      "name": "agent-afk",
      "version": "5.335.0",
      "weekly_downloads": 69834,
      "registry_listed": false,
      "registry_name": null,
      "sources": [
        "npm_search"
      ]
    },
    {
      "name": "@bike4mind/cli",
      "version": "4.0.0",
      "weekly_downloads": 69343,
      "registry_listed": false,
      "registry_name": null,
      "sources": [
        "npm_search"
      ]
    },
    {
      "name": "@azure/mcp",
      "version": "4.0.0-beta.3",
      "weekly_downloads": 68622,
      "registry_listed": true,
      "registry_name": "com.microsoft/azure",
      "sources": [
        "mcp_registry",
        "npm_search"
      ]
    },
    {
      "name": "@supabase/mcp-server-supabase",
      "version": "0.14.0",
      "weekly_downloads": 68012,
      "registry_listed": true,
      "registry_name": "com.supabase/mcp",
      "sources": [
        "mcp_registry",
        "npm_search"
      ]
    },
    {
      "name": "supergateway",
      "version": "4.2.1",
      "weekly_downloads": 66702,
      "registry_listed": false,
      "registry_name": null,
      "sources": [
        "npm_search"
      ]
    },
    {
      "name": "agentation-mcp",
      "version": "1.3.2",
      "weekly_downloads": 66602,
      "registry_listed": false,
      "registry_name": null,
      "sources": [
        "npm_search"
      ]
    },
    {
      "name": "@hostinger/mcp",
      "version": "3.8.1",
      "weekly_downloads": 65432,
      "registry_listed": true,